material,import_reliance_pct,top_producer,top_producer_share_pct,us_production_exists,price_2024_usd,price_unit,5yr_price_change_pct,demand_growth_pct,market_size_bn,technology_readiness,capex_intensity,importance_short,risk_short,importance_medium,risk_medium,criticality_category,primary_use,bulk_transport_benefit,central_location_benefit,existing_infrastructure,kc_notes,supply_risk_score,market_opportunity_score,kc_advantage_score,production_feasibility_score,strategic_alignment_score,composite_score,rank
Lithium,25,Australia,47,True,15000,metric ton,180,20,8.5,7,8,4,3,4,3,Near-Critical,Battery,8,9,5,High value-to-weight ratio reduces transport advantage; central location excellent for battery plant distribution,4.7,8.6,7.6,6.4,7.5,6.82,1
Graphite,100,China,77,False,1200,metric ton,10,15,4.5,5,5,4,4,4,4,Critical,Battery,9,8,5,Excellent bulk transport benefit; heavy material benefits from rail/barge; growing battery anode demand,9.3,4.2,7.6,4.3,8.0,6.76,2
Rare Earths,95,China,70,True,85,kg oxide,45,12,5.8,6,9,4,4,4,4,Critical,Magnet,6,8,3,Lower bulk benefit (smaller volumes); central location good; limited existing RE processing,8.8,4.3,6.0,5.6,6.0,6.28,3
Manganese,100,South Africa,37,False,1800,metric ton,5,5,22.0,7,4,3,2,3,2,Lower-Risk,Battery,9,8,6,Excellent bulk transport; heavy material; some existing steel/alloy infrastructure applicable,8.1,2.1,7.9,5.6,6.5,6.05,4
Nickel,56,Indonesia,49,True,18000,metric ton,-25,6,35.0,8,6,3,3,4,4,Near-Critical,Battery,8,8,6,Good bulk transport via rail; existing metal processing infrastructure in region,6.3,2.2,7.5,7.5,7.0,6.04,5
Cobalt,76,DRC,74,False,33000,metric ton,-15,8,15.2,6,7,4,4,4,4,Critical,Battery,7,9,4,Moderate bulk benefit; excellent distribution hub for processed cobalt to Midwest battery plants,8.0,2.6,7.0,4.2,8.0,6.01,6
